oasis_profile_code,noc_code,profile_title,unit_group_title,profile_suffix,is_unit_group_profile,unit_group_profile_count,mapping_kind,mapping_status
00010.00,00010,Legislators,Legislators,00,True,1,one_to_one,mapped
00011.00,00011,Senior government managers and officials,Senior government managers and officials,00,True,1,one_to_one,mapped
00012.00,00012,"Senior managers - financial, communications and other business services","Senior managers - financial, communications and other business services",00,True,1,one_to_one,mapped
00013.00,00013,"Senior managers - health, education, social and community services and membership organizations","Senior managers - health, education, social and community services and membership organizations",00,True,1,one_to_one,mapped
00014.00,00014,"Senior managers - trade, broadcasting and other services","Senior managers - trade, broadcasting and other services",00,True,1,one_to_one,mapped
00015.00,00015,"Senior managers - construction, transportation, production and utilities","Senior managers - construction, transportation, production and utilities",00,True,1,one_to_one,mapped
10010.00,10010,Financial managers,Financial managers,00,True,1,one_to_one,mapped
10011.00,10011,Human resources managers,Human resources managers,00,True,1,one_to_one,mapped
10012.00,10012,Purchasing managers,Purchasing managers,00,True,1,one_to_one,mapped
10019.00,10019,Other administrative services managers,Other administrative services managers,00,True,1,one_to_one,mapped
10020.01,10020,Insurance managers,"Insurance, real estate and financial brokerage managers",01,False,4,one_to_many,mapped
10020.02,10020,Real estate service managers,"Insurance, real estate and financial brokerage managers",02,False,4,one_to_many,mapped
10020.03,10020,Mortgage broker managers,"Insurance, real estate and financial brokerage managers",03,False,4,one_to_many,mapped
10020.04,10020,Securities manager,"Insurance, real estate and financial brokerage managers",04,False,4,one_to_many,mapped
10021.01,10021,Banking and other investment managers,"Banking, credit and other investment managers",01,False,2,one_to_many,mapped
10021.02,10021,Credit managers,"Banking, credit and other investment managers",02,False,2,one_to_many,mapped
10022.01,10022,Advertising managers,"Advertising, marketing and public relations managers",01,False,4,one_to_many,mapped
10022.02,10022,Marketing managers,"Advertising, marketing and public relations managers",02,False,4,one_to_many,mapped
10022.03,10022,Public relation managers,"Advertising, marketing and public relations managers",03,False,4,one_to_many,mapped
10022.04,10022,E-business managers,"Advertising, marketing and public relations managers",04,False,4,one_to_many,mapped
10029.00,10029,Other business services managers,Other business services managers,00,True,1,one_to_one,mapped
10030.00,10030,Telecommunication carriers managers,Telecommunication carriers managers,00,True,1,one_to_one,mapped
11100.01,11100,Financial auditors,Financial auditors and accountants,01,False,2,one_to_many,mapped
11100.02,11100,Accountants,Financial auditors and accountants,02,False,2,one_to_many,mapped
11101.01,11101,Financial analysts,Financial and investment analysts,01,False,2,one_to_many,mapped
11101.02,11101,Investment analysts,Financial and investment analysts,02,False,2,one_to_many,mapped
11102.00,11102,Financial advisors,Financial advisors,00,True,1,one_to_one,mapped
11103.01,11103,Securities agents and investment dealers,"Securities agents, investment dealers and brokers",01,False,2,one_to_many,mapped
11103.02,11103,Brokers,"Securities agents, investment dealers and brokers",02,False,2,one_to_many,mapped
11109.01,11109,Financial examiners and inspectors,Other financial officers,01,False,5,one_to_many,mapped
11109.02,11109,Financial investigators,Other financial officers,02,False,5,one_to_many,mapped
11109.03,11109,Financial Underwriters,Other financial officers,03,False,5,one_to_many,mapped
11109.04,11109,Trust officers,Other financial officers,04,False,5,one_to_many,mapped
11109.05,11109,Mortgage brokers,Other financial officers,05,False,5,one_to_many,mapped
11200.00,11200,Human resources professionals,Human resources professionals,00,True,1,one_to_one,mapped
11201.00,11201,Professional occupations in business management consulting,Professional occupations in business management consulting,00,True,1,one_to_one,mapped
11202.00,11202,"Professional occupations in marketing, advertising and public relations","Professional occupations in advertising, marketing and public relations",00,True,1,one_to_one,mapped
12010.00,12010,"Supervisors, general office and administrative support workers","Supervisors, general office and administrative support workers",00,True,1,one_to_one,mapped
12011.00,12011,"Supervisors, finance and insurance office workers","Supervisors, finance and insurance office workers",00,True,1,one_to_one,mapped
12012.00,12012,"Supervisors, library, correspondence and related information workers","Supervisors, library, correspondence and related information workers",00,True,1,one_to_one,mapped
12013.00,12013,"Supervisors, supply chain, tracking and scheduling coordination occupations","Supervisors, supply chain, tracking and scheduling coordination occupations",00,True,1,one_to_one,mapped
12100.00,12100,Executive assistants,Executive assistants,00,True,1,one_to_one,mapped
12101.00,12101,Human resources and recruitment officers,Human resources and recruitment officers,00,True,1,one_to_one,mapped
12102.00,12102,Procurement and purchasing agents and officers,Procurement and purchasing agents and officers,00,True,1,one_to_one,mapped
12103.00,12103,Conference and event planners,Conference and event planners,00,True,1,one_to_one,mapped
12104.01,12104,Excise tax revenue officers,Employment insurance and revenue officers,01,False,2,one_to_many,mapped
12104.02,12104,Government benefits services officers,Employment insurance and revenue officers,02,False,2,one_to_many,mapped
12110.01,12110,Court reporters,"Court reporters, medical transcriptionists and related occupations",01,False,2,one_to_many,mapped
12110.02,12110,Medical transcriptionists,"Court reporters, medical transcriptionists and related occupations",02,False,2,one_to_many,mapped
12111.00,12111,Health information management occupations,Health information management occupations,00,True,1,one_to_one,mapped
12112.00,12112,Records management technicians,Records management technicians,00,True,1,one_to_one,mapped
12113.00,12113,Statistical officers and related research support occupations,Statistical officers and related research support occupations,00,True,1,one_to_one,mapped
12200.00,12200,Accounting technicians and bookkeepers,Accounting technicians and bookkeepers,00,True,1,one_to_one,mapped
12201.01,12201,Insurance adjusters,Insurance adjusters and claims examiners,01,False,2,one_to_many,mapped
12201.02,12201,Insurance claims examiners,Insurance adjusters and claims examiners,02,False,2,one_to_many,mapped
12202.00,12202,Insurance underwriters,Insurance underwriters,00,True,1,one_to_one,mapped
12203.01,12203,Assessors,"Assessors, business valuators and appraisers",01,False,3,one_to_many,mapped
12203.02,12203,Business valuators,"Assessors, business valuators and appraisers",02,False,3,one_to_many,mapped
12203.03,12203,Appraisers,"Assessors, business valuators and appraisers",03,False,3,one_to_many,mapped
13100.00,13100,Administrative officers,Administrative officers,00,True,1,one_to_one,mapped
13101.00,13101,Property administrators,Property administrators,00,True,1,one_to_one,mapped
13102.00,13102,Payroll administrators,Payroll administrators,00,True,1,one_to_one,mapped
13110.00,13110,Administrative assistants,Administrative assistants,00,True,1,one_to_one,mapped
13111.00,13111,Legal administrative assistants,Legal administrative assistants,00,True,1,one_to_one,mapped
13112.00,13112,Medical administrative assistants,Medical administrative assistants,00,True,1,one_to_one,mapped
13200.01,13200,Custom brokers,"Customs, ship and other brokers",01,False,2,one_to_many,mapped
13200.02,13200,Ship brokers,"Customs, ship and other brokers",02,False,2,one_to_many,mapped
13201.01,13201,Production logistics coordinators,Production and transportation logistics coordinators,01,False,2,one_to_many,mapped
13201.02,13201,Transportation logistics coordinators,Production and transportation logistics coordinators,02,False,2,one_to_many,mapped
14100.01,14100,General office support workers,General office support workers,01,False,2,one_to_many,mapped
14100.02,14100,File clerks,General office support workers,02,False,2,one_to_many,mapped
14101.01,14101,Receptionists,Receptionists,01,False,4,one_to_many,mapped
14101.02,14101,Hospital admitting clerks,Receptionists,02,False,4,one_to_many,mapped
14101.03,14101,Switchboard and answering service operators,Receptionists,03,False,4,one_to_many,mapped
14101.04,14101,Telephone operators,Receptionists,04,False,4,one_to_many,mapped
14102.00,14102,Personnel clerks,Personnel clerks,00,True,1,one_to_one,mapped
14103.00,14103,Court clerks and related court services occupations,Court clerks and related court services occupations,00,True,1,one_to_one,mapped
14110.01,14110,Survey interviewers,Survey interviewers and statistical clerks,01,False,2,one_to_many,mapped
14110.02,14110,Statistical clerks,Survey interviewers and statistical clerks,02,False,2,one_to_many,mapped
14111.00,14111,Data entry clerks,Data entry clerks,00,True,1,one_to_one,mapped
14112.01,14112,Desktop publishing operators,Desktop publishing operators and related occupations,01,False,2,one_to_many,mapped
14112.02,14112,Typesetting input and output operators,Desktop publishing operators and related occupations,02,False,2,one_to_many,mapped
14200.00,14200,Accounting and related clerks,Accounting and related clerks,00,True,1,one_to_one,mapped
14201.01,14201,Bank clerks,"Banking, insurance and other financial clerks",01,False,3,one_to_many,mapped
14201.02,14201,Insurance clerks,"Banking, insurance and other financial clerks",02,False,3,one_to_many,mapped
14201.03,14201,Other financial clerks,"Banking, insurance and other financial clerks",03,False,3,one_to_many,mapped
14202.00,14202,Collection clerks,Collection clerks,00,True,1,one_to_one,mapped
14300.00,14300,Library assistants and clerks,Library assistants and clerks,00,True,1,one_to_one,mapped
14301.01,14301,Classified advertising clerks,"Correspondence, publication and regulatory clerks",01,False,5,one_to_many,mapped
14301.02,14301,Correspondence clerks,"Correspondence, publication and regulatory clerks",02,False,5,one_to_many,mapped
14301.03,14301,Proofreaders and editorial assistants,"Correspondence, publication and regulatory clerks",03,False,5,one_to_many,mapped
14301.04,14301,Readers and press clippers,"Correspondence, publication and regulatory clerks",04,False,5,one_to_many,mapped
14301.05,14301,Regulatory clerks,"Correspondence, publication and regulatory clerks",05,False,5,one_to_many,mapped
14400.00,14400,Shippers and receivers,Shippers and receivers,00,True,1,one_to_one,mapped
14401.00,14401,Storekeepers and partspersons,Storekeepers and partspersons,00,True,1,one_to_one,mapped
14402.00,14402,Production logistics workers,Production logistics workers,00,True,1,one_to_one,mapped
14403.01,14403,Purchasing control workers,Purchasing and inventory control workers,01,False,2,one_to_many,mapped
14403.02,14403,Inventory control workers,Purchasing and inventory control workers,02,False,2,one_to_many,mapped
14404.00,14404,Dispatchers,Dispatchers,00,True,1,one_to_one,mapped
14405.00,14405,Transportation route and crew schedulers,Transportation route and crew schedulers,00,True,1,one_to_one,mapped
20010.00,20010,Engineering managers,Engineering managers,00,True,1,one_to_one,mapped
20011.01,20011,Architecture and urban planning managers,Architecture and science managers,01,False,2,one_to_many,mapped
20011.02,20011,Science Managers,Architecture and science managers,02,False,2,one_to_many,mapped
20012.00,20012,Computer and information systems managers,Computer and information systems managers,00,True,1,one_to_one,mapped
21100.01,21100,Physicists,Physicists and astronomers,01,False,2,one_to_many,mapped
21100.02,21100,Astronomers,Physicists and astronomers,02,False,2,one_to_many,mapped
21101.00,21101,Chemists,Chemists,00,True,1,one_to_one,mapped
21102.01,21102,Geoscientists,Geoscientists and oceanographers,01,False,2,one_to_many,mapped
21102.02,21102,Oceanographers,Geoscientists and oceanographers,02,False,2,one_to_many,mapped
21103.00,21103,Meteorologists and climatologists,Meteorologists and climatologists,00,True,1,one_to_one,mapped
21109.01,21109,Metallurgists,Other professional occupations in physical sciences,01,False,4,one_to_many,mapped
21109.02,21109,Materials scientists,Other professional occupations in physical sciences,02,False,4,one_to_many,mapped
21109.03,21109,Soil scientists,Other professional occupations in physical sciences,03,False,4,one_to_many,mapped
21109.04,21109,Astronauts,Other professional occupations in physical sciences,04,False,4,one_to_many,mapped
21110.01,21110,Biologists,Biologists and related scientists,01,False,2,one_to_many,mapped
21110.02,21110,Microbiologists and cell and molecular biologists,Biologists and related scientists,02,False,2,one_to_many,mapped
21111.00,21111,Forestry professionals,Forestry professionals,00,True,1,one_to_one,mapped
21112.00,21112,"Agricultural representatives, consultants and specialists","Agricultural representatives, consultants and specialists",00,True,1,one_to_one,mapped
21120.00,21120,Public and environmental health and safety professionals,Public and environmental health and safety professionals,00,True,1,one_to_one,mapped
21200.00,21200,Architects,Architects,00,True,1,one_to_one,mapped
21201.00,21201,Landscape architects,Landscape architects,00,True,1,one_to_one,mapped
21202.00,21202,Urban and land use planners,Urban and land use planners,00,True,1,one_to_one,mapped
21203.00,21203,Land surveyors,Land surveyors,00,True,1,one_to_one,mapped
21210.01,21210,Mathematicians,"Mathematicians, statisticians and actuaries",01,False,3,one_to_many,mapped
21210.02,21210,Statisticians,"Mathematicians, statisticians and actuaries",02,False,3,one_to_many,mapped
21210.03,21210,Actuaries,"Mathematicians, statisticians and actuaries",03,False,3,one_to_many,mapped
21211.00,21211,Data scientists,Data scientists,00,True,1,one_to_one,mapped
21220.00,21220,Cybersecurity specialists,Cybersecurity specialists,00,True,1,one_to_one,mapped
21221.00,21221,Business system specialists,Business systems specialists,00,True,1,one_to_one,mapped
21222.00,21222,Information systems specialists,Information systems specialists,00,True,1,one_to_one,mapped
21223.01,21223,Database analysts,Database analysts and data administrators,01,False,2,one_to_many,mapped
21223.02,21223,Data administrators,Database analysts and data administrators,02,False,2,one_to_many,mapped
21230.00,21230,Computer systems developers and programmers,Computer systems developers and programmers,00,True,1,one_to_one,mapped
21231.00,21231,Software engineers and designers,Software engineers and designers,00,True,1,one_to_one,mapped
21232.00,21232,Software developers and programmers,Software developers and programmers,00,True,1,one_to_one,mapped
21233.00,21233,Web designers,Web designers,00,True,1,one_to_one,mapped
21234.00,21234,Web developers and programmers,Web developers and programmers,00,True,1,one_to_one,mapped
21300.00,21300,Civil engineers,Civil engineers,00,True,1,one_to_one,mapped
21301.00,21301,Mechanical engineers,Mechanical engineers,00,True,1,one_to_one,mapped
21310.00,21310,Electrical and electronics engineers,Electrical and electronics engineers,00,True,1,one_to_one,mapped
21311.01,21311,Computer and telecommunications hardware engineers,Computer engineers (except software engineers and designers),01,False,2,one_to_many,mapped
21311.02,21311,Network system and data communication engineers,Computer engineers (except software engineers and designers),02,False,2,one_to_many,mapped
21320.00,21320,Chemical engineers,Chemical engineers,00,True,1,one_to_one,mapped
21321.00,21321,Industrial and manufacturing engineers,Industrial and manufacturing engineers,00,True,1,one_to_one,mapped
21322.00,21322,Metallurgical and materials engineers,Metallurgical and materials engineers,00,True,1,one_to_one,mapped
21330.00,21330,Mining engineers,Mining engineers,00,True,1,one_to_one,mapped
21331.00,21331,Geological engineers,Geological engineers,00,True,1,one_to_one,mapped
21332.00,21332,Petroleum engineers,Petroleum engineers,00,True,1,one_to_one,mapped
21390.00,21390,Aerospace engineers,Aerospace engineers,00,True,1,one_to_one,mapped
21399.01,21399,Agricultural and bio-resource engineers,Other professional engineers,01,False,5,one_to_many,mapped
21399.02,21399,Biomedical engineers,Other professional engineers,02,False,5,one_to_many,mapped
21399.03,21399,Engineering physicists and engineering scientists,Other professional engineers,03,False,5,one_to_many,mapped
21399.04,21399,Marine and naval engineers,Other professional engineers,04,False,5,one_to_many,mapped
21399.05,21399,Textile engineers,Other professional engineers,05,False,5,one_to_many,mapped
22100.01,22100,Chemical technologists,Chemical technologists and technicians,01,False,2,one_to_many,mapped
22100.02,22100,Chemical technicians,Chemical technologists and technicians,02,False,2,one_to_many,mapped
22101.01,22101,Geological and mineral technologists,Geological and mineral technologists and technicians,01,False,2,one_to_many,mapped
22101.02,22101,Geological and mineral technicians,Geological and mineral technologists and technicians,02,False,2,one_to_many,mapped
22110.01,22110,Biological technologists,Biological technologists and technicians,01,False,2,one_to_many,mapped
22110.02,22110,Biological technicians,Biological technologists and technicians,02,False,2,one_to_many,mapped
22111.01,22111,Fish and fish products inspectors,Agricultural and fish products inspectors,01,False,5,one_to_many,mapped
22111.02,22111,Fruit and vegetables inspectors,Agricultural and fish products inspectors,02,False,5,one_to_many,mapped
22111.03,22111,Grain inspectors,Agricultural and fish products inspectors,03,False,5,one_to_many,mapped
22111.04,22111,Meat inspectors,Agricultural and fish products inspectors,04,False,5,one_to_many,mapped
22111.05,22111,Plant protection inspectors,Agricultural and fish products inspectors,05,False,5,one_to_many,mapped
22112.00,22112,Forestry technologists and technicians,Forestry technologists and technicians,00,True,1,one_to_one,mapped
22113.00,22113,Conservation and fishery officers,Conservation and fishery officers,00,True,1,one_to_one,mapped
22114.01,22114,Arborists and tree service technicians,Landscape and horticulture technicians and specialists,01,False,7,one_to_many,mapped
22114.02,22114,Golf course superintendents,Landscape and horticulture technicians and specialists,02,False,7,one_to_many,mapped
22114.03,22114,Horticulturists,Landscape and horticulture technicians and specialists,03,False,7,one_to_many,mapped
22114.04,22114,Landscape designers and landscape architectural technicians and technologists,Landscape and horticulture technicians and specialists,04,False,7,one_to_many,mapped
22114.05,22114,Landscape gardeners,Landscape and horticulture technicians and specialists,05,False,7,one_to_many,mapped
22114.06,22114,Landscapers,Landscape and horticulture technicians and specialists,06,False,7,one_to_many,mapped
22114.07,22114,Lawn care specialists,Landscape and horticulture technicians and specialists,07,False,7,one_to_many,mapped
22210.00,22210,Architectural technologists and technicians,Architectural technologists and technicians,00,True,1,one_to_one,mapped
22211.00,22211,Industrial designers,Industrial designers,00,True,1,one_to_one,mapped
22212.01,22212,Drafting technologists,Drafting technologists and technicians,01,False,2,one_to_many,mapped
22212.02,22212,Drafting technicians,Drafting technologists and technicians,02,False,2,one_to_many,mapped
22213.01,22213,Land survey technologists,Land survey technologists and technicians,01,False,2,one_to_many,mapped
22213.02,22213,Land survey technicians,Land survey technologists and technicians,02,False,2,one_to_many,mapped
22214.01,22214,Cartographic technologists and technicians,Technical occupations in geomatics and meteorology,01,False,5,one_to_many,mapped
22214.02,22214,Photogrammetric technologists and technicians,Technical occupations in geomatics and meteorology,02,False,5,one_to_many,mapped
22214.03,22214,Aerial survey and remote sensing technologists and technicians,Technical occupations in geomatics and meteorology,03,False,5,one_to_many,mapped
22214.04,22214,Geographic information system (GIS) technologists and technicians,Technical occupations in geomatics and meteorology,04,False,5,one_to_many,mapped
22214.05,22214,Meteorological technologists and technicians,Technical occupations in geomatics and meteorology,05,False,5,one_to_many,mapped
22220.01,22220,Computer and network operators,Computer network and web technicians,01,False,2,one_to_many,mapped
22220.02,22220,Web technicians,Computer network and web technicians,02,False,2,one_to_many,mapped
22221.00,22221,User support technicians,User support technicians,00,True,1,one_to_one,mapped
22222.00,22222,Information systems testing technicians,Information systems testing technicians,00,True,1,one_to_one,mapped
22230.00,22230,Non-destructive testers and inspectors,Non-destructive testers and inspectors,00,True,1,one_to_one,mapped
22231.01,22231,Motor Vehicle defects investigators,Engineering inspectors and regulatory officers,01,False,5,one_to_many,mapped
22231.02,22231,Railway accident investigation officers,Engineering inspectors and regulatory officers,02,False,5,one_to_many,mapped
22231.03,22231,Airworthiness inspectors,Engineering inspectors and regulatory officers,03,False,5,one_to_many,mapped
22231.04,22231,"Inspectors, weights and measures",Engineering inspectors and regulatory officers,04,False,5,one_to_many,mapped
22231.05,22231,Oil and gas drilling rig inspectors,Engineering inspectors and regulatory officers,05,False,5,one_to_many,mapped
22232.00,22232,Occupational health and safety specialists,Occupational health and safety specialists,00,True,1,one_to_one,mapped
22233.00,22233,Construction inspectors,Construction inspectors,00,True,1,one_to_one,mapped
22300.01,22300,Civil engineering technologists,Civil engineering technologists and technicians,01,False,2,one_to_many,mapped
22300.02,22300,Civil engineering technicians,Civil engineering technologists and technicians,02,False,2,one_to_many,mapped
22301.01,22301,Mechanical engineering technologists,Mechanical engineering technologists and technicians,01,False,2,one_to_many,mapped
22301.02,22301,Mechanical engineering technicians,Mechanical engineering technologists and technicians,02,False,2,one_to_many,mapped
22302.01,22302,Industrial engineering and manufacturing technologists,Industrial engineering and manufacturing technologists and technicians,01,False,2,one_to_many,mapped
22302.02,22302,Industrial engineering and manufacturing technicians,Industrial engineering and manufacturing technologists and technicians,02,False,2,one_to_many,mapped
22303.00,22303,Construction estimators,Construction estimators,00,True,1,one_to_one,mapped
22310.01,22310,Electrical and electronics engineering technologists,Electrical and electronics engineering technologists and technicians,01,False,2,one_to_many,mapped
22310.02,22310,Electrical and electronics engineering technicians,Electrical and electronics engineering technologists and technicians,02,False,2,one_to_many,mapped
22311.00,22311,Electronic service technicians (household and business equipment),Electronic service technicians (household and business equipment),00,True,1,one_to_one,mapped
22312.00,22312,Industrial instrument technicians and mechanics,Industrial instrument technicians and mechanics,00,True,1,one_to_one,mapped
22313.01,22313,Aircraft instrument mechanics and technicians,"Aircraft instrument, electrical and avionics mechanics, technicians and inspectors",01,False,4,one_to_many,mapped
22313.02,22313,Aircraft electrical mechanics and technicians,"Aircraft instrument, electrical and avionics mechanics, technicians and inspectors",02,False,4,one_to_many,mapped
22313.03,22313,Avionics mechanics and technicians,"Aircraft instrument, electrical and avionics mechanics, technicians and inspectors",03,False,4,one_to_many,mapped
22313.04,22313,Avionics inspectors,"Aircraft instrument, electrical and avionics mechanics, technicians and inspectors",04,False,4,one_to_many,mapped
30010.00,30010,Managers in health care,Managers in health care,00,True,1,one_to_one,mapped
31100.01,31100,Anesthesiologists,Specialists in clinical and laboratory medicine,01,False,14,one_to_many,mapped
31100.02,31100,"Internists, general",Specialists in clinical and laboratory medicine,02,False,14,one_to_many,mapped
31100.03,31100,"Pediatricians, general",Specialists in clinical and laboratory medicine,03,False,14,one_to_many,mapped
31100.04,31100,Psychiatrists,Specialists in clinical and laboratory medicine,04,False,14,one_to_many,mapped
31100.05,31100,Allergists and immunologists,Specialists in clinical and laboratory medicine,05,False,14,one_to_many,mapped
31100.06,31100,Hospitalists,Specialists in clinical and laboratory medicine,06,False,14,one_to_many,mapped
31100.07,31100,Neurologists,Specialists in clinical and laboratory medicine,07,False,14,one_to_many,mapped
31100.08,31100,Nuclear medicine physicians,Specialists in clinical and laboratory medicine,08,False,14,one_to_many,mapped
31100.09,31100,Dermatologists,Specialists in clinical and laboratory medicine,09,False,14,one_to_many,mapped
31100.10,31100,Physical medicine and rehabilitation physicians,Specialists in clinical and laboratory medicine,10,False,14,one_to_many,mapped
