oasis_profile_code,noc_code,profile_title,unit_group_title,profile_suffix,is_unit_group_profile,unit_group_profile_count,mapping_kind,mapping_status
31100.11,31100,Preventive medicine physicians,Specialists in clinical and laboratory medicine,11,False,14,one_to_many,mapped
31100.12,31100,Radiologists,Specialists in clinical and laboratory medicine,12,False,14,one_to_many,mapped
31100.13,31100,Other specialists in clinical medicine,Specialists in clinical and laboratory medicine,13,False,14,one_to_many,mapped
31100.14,31100,"Specialists in laboratory medicine, including pathologists",Specialists in clinical and laboratory medicine,14,False,14,one_to_many,mapped
31101.01,31101,General surgery,Specialists in surgery,01,False,5,one_to_many,mapped
31101.02,31101,Obstetricians and gynecologists,Specialists in surgery,02,False,5,one_to_many,mapped
31101.03,31101,Ophthalmologists,Specialists in surgery,03,False,5,one_to_many,mapped
31101.04,31101,Urologists,Specialists in surgery,04,False,5,one_to_many,mapped
31101.05,31101,Other specialists in surgery,Specialists in surgery,05,False,5,one_to_many,mapped
31102.00,31102,General practitioners and family physicians,General practitioners and family physicians,00,True,1,one_to_one,mapped
31103.00,31103,Veterinarians,Veterinarians,00,True,1,one_to_one,mapped
31110.01,31110,"Dentists, General",Dentists,01,False,4,one_to_many,mapped
31110.02,31110,Oral and Maxillofacial Surgeons,Dentists,02,False,4,one_to_many,mapped
31110.03,31110,Orthodontists,Dentists,03,False,4,one_to_many,mapped
31110.04,31110,Prosthodontists,Dentists,04,False,4,one_to_many,mapped
31111.00,31111,Optometrists,Optometrists,00,True,1,one_to_one,mapped
31112.01,31112,Audiologists,Audiologists and speech-language pathologists,01,False,2,one_to_many,mapped
31112.02,31112,Speech language pathologists,Audiologists and speech-language pathologists,02,False,2,one_to_many,mapped
31120.01,31120,Community pharmacists and hospital pharmacists,Pharmacists,01,False,2,one_to_many,mapped
31120.02,31120,Industrial pharmacists,Pharmacists,02,False,2,one_to_many,mapped
31121.00,31121,Dietitians and nutritionists,Dietitians and nutritionists,00,True,1,one_to_one,mapped
31200.00,31200,Psychologists,Psychologists,00,True,1,one_to_one,mapped
31201.00,31201,Chiropractors,Chiropractors,00,True,1,one_to_one,mapped
31202.00,31202,Physiotherapists,Physiotherapists,00,True,1,one_to_one,mapped
31203.00,31203,Occupational therapists,Occupational therapists,00,True,1,one_to_one,mapped
31204.01,31204,Recreational therapists,Kinesiologists and other professional occupations in therapy and assessment,01,False,2,one_to_many,mapped
31204.02,31204,Kinesiologists and exercise therapists,Kinesiologists and other professional occupations in therapy and assessment,02,False,2,one_to_many,mapped
31209.01,31209,Doctors of Podiatric Medicine,Other professional occupations in health diagnosing and treating,01,False,4,one_to_many,mapped
31209.02,31209,Chiropodists and diploma or first-degree trained podiatrists,Other professional occupations in health diagnosing and treating,02,False,4,one_to_many,mapped
31209.03,31209,Doctors of naturopathics medicine,Other professional occupations in health diagnosing and treating,03,False,4,one_to_many,mapped
31209.04,31209,Doctors of osteopathic medicine,Other professional occupations in health diagnosing and treating,04,False,4,one_to_many,mapped
31300.00,31300,Nursing coordinators and supervisors,Nursing coordinators and supervisors,00,True,1,one_to_one,mapped
31301.01,31301,General duty registered nurses,Registered nurses and registered psychiatric nurses,01,False,6,one_to_many,mapped
31301.02,31301,Occupational health nurses,Registered nurses and registered psychiatric nurses,02,False,6,one_to_many,mapped
31301.03,31301,Community Health Nurses,Registered nurses and registered psychiatric nurses,03,False,6,one_to_many,mapped
31301.04,31301,Registered psychiatric nurses,Registered nurses and registered psychiatric nurses,04,False,6,one_to_many,mapped
31301.05,31301,Nursing researchers and consultants,Registered nurses and registered psychiatric nurses,05,False,6,one_to_many,mapped
31301.06,31301,Clinical nurses,Registered nurses and registered psychiatric nurses,06,False,6,one_to_many,mapped
31302.00,31302,Nurse practitioners,Nurse practitioners,00,True,1,one_to_one,mapped
31303.01,31303,Physician Assistants,"Physician assistants, midwives and allied health professionals",01,False,5,one_to_many,mapped
31303.02,31303,Midwives,"Physician assistants, midwives and allied health professionals",02,False,5,one_to_many,mapped
31303.03,31303,Genetic counsellors,"Physician assistants, midwives and allied health professionals",03,False,5,one_to_many,mapped
31303.04,31303,Orthoptists,"Physician assistants, midwives and allied health professionals",04,False,5,one_to_many,mapped
31303.05,31303,Pathologist assistants,"Physician assistants, midwives and allied health professionals",05,False,5,one_to_many,mapped
32100.00,32100,Opticians,Opticians,00,True,1,one_to_one,mapped
32101.01,32101,Licensed practical nurses,Licensed practical nurses,01,False,2,one_to_many,mapped
32101.02,32101,Operating room technicians,Licensed practical nurses,02,False,2,one_to_many,mapped
32102.00,32102,Paramedical occupations,Paramedical occupations,00,True,1,one_to_one,mapped
32103.01,32103,Respiratory therapists,"Respiratory therapists, clinical perfusionists and cardiopulmonary technologists",01,False,3,one_to_many,mapped
32103.02,32103,Clinical perfusionists,"Respiratory therapists, clinical perfusionists and cardiopulmonary technologists",02,False,3,one_to_many,mapped
32103.03,32103,Cardiopulmonary  technologists,"Respiratory therapists, clinical perfusionists and cardiopulmonary technologists",03,False,3,one_to_many,mapped
32104.00,32104,Animal health technologists and veterinary technicians,Animal health technologists and veterinary technicians,00,True,1,one_to_one,mapped
32109.01,32109,Hearing instrument practitioners,Other technical occupations in therapy and assessment,01,False,5,one_to_many,mapped
32109.02,32109,Communicative disorders assistants and speech-language pathology assistants,Other technical occupations in therapy and assessment,02,False,5,one_to_many,mapped
32109.03,32109,Ophthalmic technologists and technicians,Other technical occupations in therapy and assessment,03,False,5,one_to_many,mapped
32109.04,32109,Physical Rehabilitation therapists,Other technical occupations in therapy and assessment,04,False,5,one_to_many,mapped
32109.05,32109,Physiotherapy assistants and occupational therapy assistants,Other technical occupations in therapy and assessment,05,False,5,one_to_many,mapped
32110.00,32110,Denturists,Denturists,00,True,1,one_to_one,mapped
32111.01,32111,Dental hygienists,Dental hygienists and dental therapists,01,False,2,one_to_many,mapped
32111.02,32111,Dental therapists,Dental hygienists and dental therapists,02,False,2,one_to_many,mapped
32112.00,32112,Dental technologists and technicians,Dental technologists and technicians,00,True,1,one_to_one,mapped
32120.00,32120,Medical laboratory technologists,Medical laboratory technologists,00,True,1,one_to_one,mapped
32121.01,32121,Radiological technologists,Medical radiation technologists,01,False,4,one_to_many,mapped
32121.02,32121,Nuclear medicine technologists,Medical radiation technologists,02,False,4,one_to_many,mapped
32121.03,32121,Radiation therapists,Medical radiation technologists,03,False,4,one_to_many,mapped
32121.04,32121,Magnetic Resonance Technologist,Medical radiation technologists,04,False,4,one_to_many,mapped
32122.00,32122,Medical sonographers,Medical sonographers,00,True,1,one_to_one,mapped
32123.01,32123,Cardiology technologists,Cardiology technologists and electrophysiological diagnostic technologists,01,False,2,one_to_many,mapped
32123.02,32123,Electrophysiological technologists,Cardiology technologists and electrophysiological diagnostic technologists,02,False,2,one_to_many,mapped
32124.00,32124,Pharmacy technicians,Pharmacy technicians,00,True,1,one_to_one,mapped
32129.01,32129,Dietary technicians,Other medical technologists and technicians,01,False,4,one_to_many,mapped
32129.02,32129,Ocularists,Other medical technologists and technicians,02,False,4,one_to_many,mapped
32129.03,32129,Prosthetists and orthotists,Other medical technologists and technicians,03,False,4,one_to_many,mapped
32129.04,32129,Prosthetic and orthotic technicians,Other medical technologists and technicians,04,False,4,one_to_many,mapped
32200.01,32200,Traditional Chinese medicine practitioners,Traditional Chinese medicine practitioners and acupuncturists,01,False,2,one_to_many,mapped
32200.02,32200,Acupuncturists,Traditional Chinese medicine practitioners and acupuncturists,02,False,2,one_to_many,mapped
32201.00,32201,Massage therapists,Massage therapists,00,True,1,one_to_one,mapped
32209.01,32209,Herbalists,Other practitioners of natural healing,01,False,6,one_to_many,mapped
32209.02,32209,Osteopathic manual practitioners,Other practitioners of natural healing,02,False,6,one_to_many,mapped
32209.03,32209,Homeopaths,Other practitioners of natural healing,03,False,6,one_to_many,mapped
32209.04,32209,Reflexologists,Other practitioners of natural healing,04,False,6,one_to_many,mapped
32209.05,32209,Holistic nutritionists,Other practitioners of natural healing,05,False,6,one_to_many,mapped
32209.06,32209,Naturotherapists,Other practitioners of natural healing,06,False,6,one_to_many,mapped
33100.01,33100,Dental assistants,Dental assistants and dental laboratory assistants,01,False,2,one_to_many,mapped
33100.02,33100,Dental Laboratory Assistants,Dental assistants and dental laboratory assistants,02,False,2,one_to_many,mapped
33101.00,33101,Medical laboratory assistants and related technical occupations,Medical laboratory assistants and related technical occupations,00,True,1,one_to_one,mapped
33102.00,33102,"Nurse aides, orderlies and patient service associates","Nurse aides, orderlies and patient service associates",00,True,1,one_to_one,mapped
33103.00,33103,Pharmacy technical assistants and pharmacy assistants,Pharmacy technical assistants and pharmacy assistants,00,True,1,one_to_one,mapped
33109.01,33109,Audiometric technicians,Other assisting occupations in support of health services,01,False,8,one_to_many,mapped
33109.02,33109,Orthopedic technologists,Other assisting occupations in support of health services,02,False,8,one_to_many,mapped
33109.03,33109,Rehabilitation aides,Other assisting occupations in support of health services,03,False,8,one_to_many,mapped
33109.04,33109,Ophthalmic assistants,Other assisting occupations in support of health services,04,False,8,one_to_many,mapped
33109.05,33109,Optical/ophthalmic laboratory technicians and assistants,Other assisting occupations in support of health services,05,False,8,one_to_many,mapped
33109.06,33109,Sterile processing technicians,Other assisting occupations in support of health services,06,False,8,one_to_many,mapped
33109.07,33109,Blood donor clinic assistants,Other assisting occupations in support of health services,07,False,8,one_to_many,mapped
33109.08,33109,Morgue attendants,Other assisting occupations in support of health services,08,False,8,one_to_many,mapped
40010.00,40010,Government managers - health and social policy development and program administration,Government managers - health and social policy development and program administration,00,True,1,one_to_one,mapped
40011.00,40011,"Government managers - economic analysis, policy development and program administration","Government managers - economic analysis, policy development and program administration",00,True,1,one_to_one,mapped
40012.00,40012,Government managers - education policy development and program administration,Government managers - education policy development and program administration,00,True,1,one_to_one,mapped
40019.00,40019,Other managers in public administration,Other managers in public administration,00,True,1,one_to_one,mapped
40020.01,40020,Faculty administrators,Administrators - post-secondary education and vocational training,01,False,3,one_to_many,mapped
40020.02,40020,Registrars,Administrators - post-secondary education and vocational training,02,False,3,one_to_many,mapped
40020.03,40020,Administrator of vocational training schools,Administrators - post-secondary education and vocational training,03,False,3,one_to_many,mapped
40021.01,40021,School principals,School principals and administrators of elementary and secondary education,01,False,2,one_to_many,mapped
40021.02,40021,Administrators of elementary and secondary education,School principals and administrators of elementary and secondary education,02,False,2,one_to_many,mapped
40030.00,40030,"Managers in social, community and correctional services","Managers in social, community and correctional services",00,True,1,one_to_one,mapped
40040.00,40040,Commissioned police officers and related occupations in public protection services,Commissioned police officers and related occupations in public protection services,00,True,1,one_to_one,mapped
40041.00,40041,Fire chiefs and senior firefighting officers,Fire chiefs and senior firefighting officers,00,True,1,one_to_one,mapped
40042.00,40042,Commissioned officers of the Canadian Armed Forces,Commissioned officers of the Canadian Armed Forces,00,True,1,one_to_one,mapped
41100.00,41100,Judges,Judges,00,True,1,one_to_one,mapped
41101.00,41101,Lawyers and Quebec notaries,Lawyers and Quebec notaries,00,True,1,one_to_one,mapped
41200.00,41200,University professors and lecturers,University professors and lecturers,00,True,1,one_to_one,mapped
41201.01,41201,Post-secondary teaching assistants,Post-secondary teaching and research assistants,01,False,2,one_to_many,mapped
41201.02,41201,Post-secondary research assistants,Post-secondary teaching and research assistants,02,False,2,one_to_many,mapped
41210.00,41210,College and other vocational instructors,College and other vocational instructors,00,True,1,one_to_one,mapped
41220.00,41220,Secondary school teachers,Secondary school teachers,00,True,1,one_to_one,mapped
41221.00,41221,Elementary school and kindergarten teachers,Elementary school and kindergarten teachers,00,True,1,one_to_one,mapped
41300.00,41300,Social workers,Social workers,00,True,1,one_to_one,mapped
41301.00,41301,Therapists in counselling and related specialized therapies,Therapists in counselling and related specialized therapies,00,True,1,one_to_one,mapped
41302.00,41302,Religious leaders,Religious leaders,00,True,1,one_to_one,mapped
41310.01,41310,Police investigators,Police investigators and other investigative occupations,01,False,2,one_to_many,mapped
41310.02,41310,Coroners and medical examiners,Police investigators and other investigative occupations,02,False,2,one_to_many,mapped
41311.00,41311,Probation and parole officers,Probation and parole officers,00,True,1,one_to_one,mapped
41320.00,41320,Educational counsellors,Educational counsellors,00,True,1,one_to_one,mapped
41321.00,41321,Career development practitioners and career counsellors (except education),Career development practitioners and career counsellors (except education),00,True,1,one_to_one,mapped
41400.01,41400,Ergonomists,"Natural and applied science policy researchers, consultants and program officers",01,False,5,one_to_many,mapped
41400.02,41400,Occupational or industrial hygienists,"Natural and applied science policy researchers, consultants and program officers",02,False,5,one_to_many,mapped
41400.03,41400,Patent agents,"Natural and applied science policy researchers, consultants and program officers",03,False,5,one_to_many,mapped
41400.04,41400,Science policy and program officers,"Natural and applied science policy researchers, consultants and program officers",04,False,5,one_to_many,mapped
41400.05,41400,Technology transfer officers,"Natural and applied science policy researchers, consultants and program officers",05,False,5,one_to_many,mapped
41401.00,41401,Economists and economic policy researchers and analysts,Economists and economic policy researchers and analysts,00,True,1,one_to_one,mapped
41402.00,41402,Business development officers and market researchers and analysts,Business development officers and market researchers and analysts,00,True,1,one_to_one,mapped
41403.01,41403,Social policy researchers,"Social policy researchers, consultants and program officers",01,False,7,one_to_many,mapped
41403.02,41403,Home economists,"Social policy researchers, consultants and program officers",02,False,7,one_to_many,mapped
41403.03,41403,Housing policy analysts,"Social policy researchers, consultants and program officers",03,False,7,one_to_many,mapped
41403.04,41403,Immigration and citizenship consultants,"Social policy researchers, consultants and program officers",04,False,7,one_to_many,mapped
41403.05,41403,International aid and development project officers,"Social policy researchers, consultants and program officers",05,False,7,one_to_many,mapped
41403.06,41403,Social survey researchers,"Social policy researchers, consultants and program officers",06,False,7,one_to_many,mapped
41403.07,41403,Social service planners,"Social policy researchers, consultants and program officers",07,False,7,one_to_many,mapped
41404.00,41404,"Health policy researchers, consultants and program officers","Health policy researchers, consultants and program officers",00,True,1,one_to_one,mapped
41405.00,41405,"Education policy researchers, consultants and program officers","Education policy researchers, consultants and program officers",00,True,1,one_to_one,mapped
41406.01,41406,"Recreation, sports and fitness consultants","Recreation, sports and fitness policy researchers, consultants and program officers",01,False,3,one_to_many,mapped
41406.02,41406,"Recreation, sports and fitness policy analysts","Recreation, sports and fitness policy researchers, consultants and program officers",02,False,3,one_to_many,mapped
41406.03,41406,"Recreation, sports and fitness program supervisors","Recreation, sports and fitness policy researchers, consultants and program officers",03,False,3,one_to_many,mapped
41407.00,41407,Program officers unique to government,Program officers unique to government,00,True,1,one_to_one,mapped
41409.01,41409,Anthropologists,Other professional occupations in social science,01,False,9,one_to_many,mapped
41409.02,41409,Archaeologists,Other professional occupations in social science,02,False,9,one_to_many,mapped
41409.03,41409,Geographers,Other professional occupations in social science,03,False,9,one_to_many,mapped
41409.04,41409,Historians,Other professional occupations in social science,04,False,9,one_to_many,mapped
41409.05,41409,Linguists,Other professional occupations in social science,05,False,9,one_to_many,mapped
41409.06,41409,Political scientists,Other professional occupations in social science,06,False,9,one_to_many,mapped
41409.07,41409,Psychometricians,Other professional occupations in social science,07,False,9,one_to_many,mapped
41409.08,41409,Sociologists,Other professional occupations in social science,08,False,9,one_to_many,mapped
41409.09,41409,Other social science professionals,Other professional occupations in social science,09,False,9,one_to_many,mapped
42100.00,42100,Police officers (except commissioned),Police officers (except commissioned),00,True,1,one_to_one,mapped
42101.00,42101,Firefighters,Firefighters,00,True,1,one_to_one,mapped
42102.00,42102,Specialized members of the Canadian Armed Forces,Specialized members of the Canadian Armed Forces,00,True,1,one_to_one,mapped
42200.01,42200,Paralegals,Paralegals and related occupations,01,False,5,one_to_many,mapped
42200.02,42200,Independent paralegals,Paralegals and related occupations,02,False,5,one_to_many,mapped
42200.03,42200,Notaries public,Paralegals and related occupations,03,False,5,one_to_many,mapped
42200.04,42200,Trademark agents,Paralegals and related occupations,04,False,5,one_to_many,mapped
42200.05,42200,Justice of the peace,Paralegals and related occupations,05,False,5,one_to_many,mapped
42201.00,42201,Social and community service workers,Social and community service workers,00,True,1,one_to_one,mapped
42202.01,42202,Early childhood educators,Early childhood educators and assistants,01,False,2,one_to_many,mapped
42202.02,42202,Early childhood educator assistants,Early childhood educators and assistants,02,False,2,one_to_many,mapped
42203.00,42203,Instructors of persons with disabilities,Instructors of persons with disabilities,00,True,1,one_to_one,mapped
42204.00,42204,Religion workers,Religion workers,00,True,1,one_to_one,mapped
43100.00,43100,Elementary and secondary school teacher assistants,Elementary and secondary school teacher assistants,00,True,1,one_to_one,mapped
43109.01,43109,Driving instructors,Other instructors,01,False,4,one_to_many,mapped
43109.02,43109,Driver's license examiners,Other instructors,02,False,4,one_to_many,mapped
43109.03,43109,Sewing instructors,Other instructors,03,False,4,one_to_many,mapped
43109.04,43109,Modelling instructors,Other instructors,04,False,4,one_to_many,mapped
43200.00,43200,Sheriffs and bailiffs,Sheriffs and bailiffs,00,True,1,one_to_one,mapped
43201.00,43201,Correctional service officers,Correctional service officers,00,True,1,one_to_one,mapped
43202.01,43202,Animal control officer,By-law enforcement and other regulatory officers,01,False,8,one_to_many,mapped
43202.02,43202,By-law enforcement officers,By-law enforcement and other regulatory officers,02,False,8,one_to_many,mapped
43202.03,43202,Commercial transport inspectors,By-law enforcement and other regulatory officers,03,False,8,one_to_many,mapped
43202.04,43202,Garbage collection inspectors,By-law enforcement and other regulatory officers,04,False,8,one_to_many,mapped
43202.05,43202,Liquor licence inspectors,By-law enforcement and other regulatory officers,05,False,8,one_to_many,mapped
43202.06,43202,Parking control officers,By-law enforcement and other regulatory officers,06,False,8,one_to_many,mapped
43202.07,43202,Taxi inspectors,By-law enforcement and other regulatory officers,07,False,8,one_to_many,mapped
43202.08,43202,Zoning inspectors,By-law enforcement and other regulatory officers,08,False,8,one_to_many,mapped
43203.01,43203,Border services and customs officers,"Border services, customs, and immigration officers",01,False,2,one_to_many,mapped
43203.02,43203,Immigration officers,"Border services, customs, and immigration officers",02,False,2,one_to_many,mapped
43204.00,43204,Operations Members of the Canadian Armed Forces,Operations members of the Canadian Armed Forces,00,True,1,one_to_one,mapped
44100.01,44100,Home child care providers,Home child care providers,01,False,2,one_to_many,mapped
44100.02,44100,Foster parents,Home child care providers,02,False,2,one_to_many,mapped
44101.00,44101,"Home support workers, caregivers and related occupations","Home support workers, caregivers and related occupations",00,True,1,one_to_one,mapped
44200.00,44200,Primary combat members of the Canadian Armed Forces,Primary combat members of the Canadian Armed Forces,00,True,1,one_to_one,mapped
45100.01,45100,Student monitors,"Student monitors, crossing guards and related occupations",01,False,2,one_to_many,mapped
45100.02,45100,Crossing guards,"Student monitors, crossing guards and related occupations",02,False,2,one_to_many,mapped
50010.00,50010,"Library, archive, museum and art gallery managers","Library, archive, museum and art gallery managers",00,True,1,one_to_one,mapped
50011.00,50011,"Managers - publishing, motion pictures, broadcasting and performing arts","Managers - publishing, motion pictures, broadcasting and performing arts",00,True,1,one_to_one,mapped
50012.00,50012,"Recreation, sports and fitness program and service directors","Recreation, sports and fitness program and service directors",00,True,1,one_to_one,mapped
51100.00,51100,Librarians,Librarians,00,True,1,one_to_one,mapped
51101.01,51101,Conservators,Conservators and curators,01,False,2,one_to_many,mapped
51101.02,51101,Curators,Conservators and curators,02,False,2,one_to_many,mapped
51102.00,51102,Archivists,Archivists,00,True,1,one_to_one,mapped
51110.00,51110,Editors,Editors,00,True,1,one_to_one,mapped
51111.01,51111,"Novelists, playwrights, script writers, poets and other creative writers",Authors and writers (except technical),01,False,3,one_to_many,mapped
51111.02,51111,Content writers (non-technical),Authors and writers (except technical),02,False,3,one_to_many,mapped
51111.03,51111,Copywriters,Authors and writers (except technical),03,False,3,one_to_many,mapped
51112.00,51112,Technical writers,Technical writers,00,True,1,one_to_one,mapped
51113.00,51113,Journalists,Journalists,00,True,1,one_to_one,mapped
51114.01,51114,Translators and translator-revisers,"Translators, terminologists and interpreters",01,False,4,one_to_many,mapped
51114.02,51114,Terminologists,"Translators, terminologists and interpreters",02,False,4,one_to_many,mapped
51114.03,51114,Interpreters,"Translators, terminologists and interpreters",03,False,4,one_to_many,mapped
51114.04,51114,Sign language Interpreters,"Translators, terminologists and interpreters",04,False,4,one_to_many,mapped
51120.01,51120,"Film, radio, television and video game producers","Producers, directors, choreographers and related occupations",01,False,7,one_to_many,mapped
51120.02,51120,Directors,"Producers, directors, choreographers and related occupations",02,False,7,one_to_many,mapped
51120.03,51120,Choreographers,"Producers, directors, choreographers and related occupations",03,False,7,one_to_many,mapped
51120.04,51120,Art directors,"Producers, directors, choreographers and related occupations",04,False,7,one_to_many,mapped
51120.05,51120,Film editors,"Producers, directors, choreographers and related occupations",05,False,7,one_to_many,mapped
