oasis_profile_code,noc_code,profile_title,unit_group_title,profile_suffix,is_unit_group_profile,unit_group_profile_count,mapping_kind,mapping_status
51120.06,51120,Record producers,"Producers, directors, choreographers and related occupations",06,False,7,one_to_many,mapped
51120.07,51120,Directors of photography,"Producers, directors, choreographers and related occupations",07,False,7,one_to_many,mapped
51121.01,51121,Conductors,"Conductors, composers and arrangers",01,False,3,one_to_many,mapped
51121.02,51121,Composers,"Conductors, composers and arrangers",02,False,3,one_to_many,mapped
51121.03,51121,Arrangers,"Conductors, composers and arrangers",03,False,3,one_to_many,mapped
51122.01,51122,Musicians,Musicians and singers,01,False,3,one_to_many,mapped
51122.02,51122,Singers,Musicians and singers,02,False,3,one_to_many,mapped
51122.03,51122,Teachers of music or voice,Musicians and singers,03,False,3,one_to_many,mapped
52100.01,52100,Library Technicians,Library and public archive technicians,01,False,2,one_to_many,mapped
52100.02,52100,Public archive technicians,Library and public archive technicians,02,False,2,one_to_many,mapped
52110.00,52110,Film and video camera operators,Film and video camera operators,00,True,1,one_to_one,mapped
52111.00,52111,Graphic arts technicians,Graphic arts technicians,00,True,1,one_to_one,mapped
52112.00,52112,Broadcast technicians,Broadcast technicians,00,True,1,one_to_one,mapped
52113.00,52113,Audio and video recording technicians,Audio and video recording technicians,00,True,1,one_to_one,mapped
52114.00,52114,Announcers and other broadcasters,Announcers and other broadcasters,00,True,1,one_to_one,mapped
52119.01,52119,Floor managers,"Other technical and coordinating occupations in motion pictures, broadcasting and the performing arts",01,False,7,one_to_many,mapped
52119.02,52119,Key grips,"Other technical and coordinating occupations in motion pictures, broadcasting and the performing arts",02,False,7,one_to_many,mapped
52119.03,52119,Gaffers and lighting technicians,"Other technical and coordinating occupations in motion pictures, broadcasting and the performing arts",03,False,7,one_to_many,mapped
52119.04,52119,Stunt co-ordinators and special effects technicians,"Other technical and coordinating occupations in motion pictures, broadcasting and the performing arts",04,False,7,one_to_many,mapped
52119.05,52119,Make-up artists,"Other technical and coordinating occupations in motion pictures, broadcasting and the performing arts",05,False,7,one_to_many,mapped
52119.06,52119,Costumiers,"Other technical and coordinating occupations in motion pictures, broadcasting and the performing arts",06,False,7,one_to_many,mapped
52119.07,52119,Settings shop foremen and property masters,"Other technical and coordinating occupations in motion pictures, broadcasting and the performing arts",07,False,7,one_to_many,mapped
52120.01,52120,Graphic designers,Graphic designers and illustrators,01,False,2,one_to_many,mapped
52120.02,52120,Illustrators,Graphic designers and illustrators,02,False,2,one_to_many,mapped
52121.00,52121,Interior designers and interior decorators,Interior designers and interior decorators,00,True,1,one_to_one,mapped
53100.01,53100,Conservation and restoration technicians,"Registrars, restorers, interpreters and other occupations related to museum and art galleries",01,False,5,one_to_many,mapped
53100.02,53100,Preparators and picture framers,"Registrars, restorers, interpreters and other occupations related to museum and art galleries",02,False,5,one_to_many,mapped
53100.03,53100,Museum interpreters,"Registrars, restorers, interpreters and other occupations related to museum and art galleries",03,False,5,one_to_many,mapped
53100.04,53100,"Curatorial assistants, museum extension officers, museology technicians and museum registrars and cataloguers","Registrars, restorers, interpreters and other occupations related to museum and art galleries",04,False,5,one_to_many,mapped
53100.05,53100,Taxidermists,"Registrars, restorers, interpreters and other occupations related to museum and art galleries",05,False,5,one_to_many,mapped
53110.00,53110,Photographers,Photographers,00,True,1,one_to_one,mapped
53111.01,53111,Camera crane operators,"Motion pictures, broadcasting, photography and performing arts assistants and operators",01,False,7,one_to_many,mapped
53111.02,53111,Motion picture projectionists,"Motion pictures, broadcasting, photography and performing arts assistants and operators",02,False,7,one_to_many,mapped
53111.03,53111,Props persons and set builders,"Motion pictures, broadcasting, photography and performing arts assistants and operators",03,False,7,one_to_many,mapped
53111.04,53111,Scripts assistants,"Motion pictures, broadcasting, photography and performing arts assistants and operators",04,False,7,one_to_many,mapped
53111.05,53111,Grips and riggers,"Motion pictures, broadcasting, photography and performing arts assistants and operators",05,False,7,one_to_many,mapped
53111.06,53111,Dressers,"Motion pictures, broadcasting, photography and performing arts assistants and operators",06,False,7,one_to_many,mapped
53111.07,53111,Production assistants,"Motion pictures, broadcasting, photography and performing arts assistants and operators",07,False,7,one_to_many,mapped
53120.01,53120,Dancers,Dancers,01,False,2,one_to_many,mapped
53120.02,53120,Dance teachers,Dancers,02,False,2,one_to_many,mapped
53121.01,53121,Actors and comedians,"Actors, comedians and circus performers",01,False,3,one_to_many,mapped
53121.02,53121,Acting teachers,"Actors, comedians and circus performers",02,False,3,one_to_many,mapped
53121.03,53121,Circus and other performers,"Actors, comedians and circus performers",03,False,3,one_to_many,mapped
53122.01,53122,Painters,"Painters, sculptors and other visual artists",01,False,3,one_to_many,mapped
53122.02,53122,Sculptors,"Painters, sculptors and other visual artists",02,False,3,one_to_many,mapped
53122.03,53122,Art instructors and teachers,"Painters, sculptors and other visual artists",03,False,3,one_to_many,mapped
53123.01,53123,Theatre designers,"Theatre, fashion, exhibit and other creative designers",01,False,3,one_to_many,mapped
53123.02,53123,Fashion designers,"Theatre, fashion, exhibit and other creative designers",02,False,3,one_to_many,mapped
53123.03,53123,Exhibit designers,"Theatre, fashion, exhibit and other creative designers",03,False,3,one_to_many,mapped
53124.01,53124,Carvers,Artisans and craftspersons,01,False,9,one_to_many,mapped
53124.02,53124,Glass blowers,Artisans and craftspersons,02,False,9,one_to_many,mapped
53124.03,53124,Metal art workers,Artisans and craftspersons,03,False,9,one_to_many,mapped
53124.04,53124,Potters,Artisans and craftspersons,04,False,9,one_to_many,mapped
53124.05,53124,Stained glass artists,Artisans and craftspersons,05,False,9,one_to_many,mapped
53124.06,53124,Instrument makers,Artisans and craftspersons,06,False,9,one_to_many,mapped
53124.07,53124,Weavers,Artisans and craftspersons,07,False,9,one_to_many,mapped
53124.08,53124,Craft instructors,Artisans and craftspersons,08,False,9,one_to_many,mapped
53124.09,53124,Artistic floral arrangers,Artisans and craftspersons,09,False,9,one_to_many,mapped
53125.00,53125,"Patternmakers - textile, leather and fur products","Patternmakers - textile, leather and fur products",00,True,1,one_to_one,mapped
53200.00,53200,Athletes,Athletes,00,True,1,one_to_one,mapped
53201.01,53201,Coaches,Coaches,01,False,2,one_to_many,mapped
53201.02,53201,Sports scouts,Coaches,02,False,2,one_to_many,mapped
53202.00,53202,Sports officials and referees,Sports officials and referees,00,True,1,one_to_one,mapped
54100.01,54100,Program leaders and instructors in recreation and sport,"Program leaders and instructors in recreation, sport and fitness",01,False,2,one_to_many,mapped
54100.02,54100,Fitness appraisers,"Program leaders and instructors in recreation, sport and fitness",02,False,2,one_to_many,mapped
55109.01,55109,Buskers,Other performers,01,False,4,one_to_many,mapped
55109.02,55109,Magicians and illusionists,Other performers,02,False,4,one_to_many,mapped
55109.03,55109,Fashion Models,Other performers,03,False,4,one_to_many,mapped
55109.04,55109,Influencers,Other performers,04,False,4,one_to_many,mapped
60010.00,60010,Corporate sales managers,Corporate sales managers,00,True,1,one_to_one,mapped
60020.00,60020,Retail and wholesale trade managers,Retail and wholesale trade managers,00,True,1,one_to_one,mapped
60030.00,60030,Restaurant and food service managers,Restaurant and food service managers,00,True,1,one_to_one,mapped
60031.00,60031,Accommodation service managers,Accommodation service managers,00,True,1,one_to_one,mapped
60040.00,60040,Managers in customer and personal services,Managers in customer and personal services,00,True,1,one_to_one,mapped
62010.00,62010,Retail sales supervisors,Retail sales supervisors,00,True,1,one_to_one,mapped
62020.00,62020,Food service supervisors,Food service supervisors,00,True,1,one_to_one,mapped
62021.00,62021,Executive housekeepers,Executive housekeepers,00,True,1,one_to_one,mapped
62022.00,62022,"Accommodation, travel, tourism and related services supervisors","Accommodation, travel, tourism and related services supervisors",00,True,1,one_to_one,mapped
62023.01,62023,Customer service representatives supervisors - financial services,Customer and information services supervisors,01,False,2,one_to_many,mapped
62023.02,62023,Customer service representatives supervisors (except financial services),Customer and information services supervisors,02,False,2,one_to_many,mapped
62024.00,62024,Cleaning supervisors,Cleaning supervisors,00,True,1,one_to_one,mapped
62029.00,62029,Other services supervisors,Other services supervisors,00,True,1,one_to_one,mapped
62100.00,62100,Technical sales specialists - wholesale trade,Technical sales specialists - wholesale trade,00,True,1,one_to_one,mapped
62101.00,62101,Retail and wholesale buyers,Retail and wholesale buyers,00,True,1,one_to_one,mapped
62200.01,62200,Head Chefs,Chefs,01,False,3,one_to_many,mapped
62200.02,62200,Sous-Chefs,Chefs,02,False,3,one_to_many,mapped
62200.03,62200,Specialist chefs,Chefs,03,False,3,one_to_many,mapped
62201.01,62201,Funeral directors,Funeral directors and embalmers,01,False,2,one_to_many,mapped
62201.02,62201,Embalmers,Funeral directors and embalmers,02,False,2,one_to_many,mapped
62202.01,62202,Jewellers and related workers,"Jewellers, jewellery and watch repairers and related occupations",01,False,2,one_to_many,mapped
62202.02,62202,Watch repairers,"Jewellers, jewellery and watch repairers and related occupations",02,False,2,one_to_many,mapped
63100.00,63100,Insurance agents and brokers,Insurance agents and brokers,00,True,1,one_to_one,mapped
63101.00,63101,Real estate agents and salespersons,Real estate agents and salespersons,00,True,1,one_to_one,mapped
63102.00,63102,Financial sales representatives,Financial sales representatives,00,True,1,one_to_one,mapped
63200.00,63200,Cooks,Cooks,00,True,1,one_to_one,mapped
63201.00,63201,Butchers - retail and wholesale,Butchers - retail and wholesale,00,True,1,one_to_one,mapped
63202.00,63202,Bakers,Bakers,00,True,1,one_to_one,mapped
63210.01,63210,Hairstylists,Hairstylists and barbers,01,False,2,one_to_many,mapped
63210.02,63210,Barbers,Hairstylists and barbers,02,False,2,one_to_many,mapped
63211.01,63211,Estheticians,"Estheticians, electrologists and related occupations",01,False,7,one_to_many,mapped
63211.02,63211,Cosmeticians,"Estheticians, electrologists and related occupations",02,False,7,one_to_many,mapped
63211.03,63211,Electrologists,"Estheticians, electrologists and related occupations",03,False,7,one_to_many,mapped
63211.04,63211,Manicurists and pedicurist,"Estheticians, electrologists and related occupations",04,False,7,one_to_many,mapped
63211.05,63211,Scalp treatment specialists,"Estheticians, electrologists and related occupations",05,False,7,one_to_many,mapped
63211.06,63211,Tattoo artists,"Estheticians, electrologists and related occupations",06,False,7,one_to_many,mapped
63211.07,63211,Hair replacement technicians (non-medical),"Estheticians, electrologists and related occupations",07,False,7,one_to_many,mapped
63220.01,63220,Shoemakers,Shoe repairers and shoemakers,01,False,2,one_to_many,mapped
63220.02,63220,Shoe repairers,Shoe repairers and shoemakers,02,False,2,one_to_many,mapped
63221.00,63221,Upholsterers,Upholsterers,00,True,1,one_to_one,mapped
64100.01,64100,Retail salespersons,Retail salespersons and visual merchandisers,01,False,2,one_to_many,mapped
64100.02,64100,Visual merchandisers,Retail salespersons and visual merchandisers,02,False,2,one_to_many,mapped
64101.00,64101,Sales and account representatives - wholesale trade (non-technical),Sales and account representatives - wholesale trade (non-technical),00,True,1,one_to_one,mapped
64200.01,64200,"Tailors, Dressmakers and Alterationists","Tailors, dressmakers, furriers and milliners",01,False,3,one_to_many,mapped
64200.02,64200,Furriers,"Tailors, dressmakers, furriers and milliners",02,False,3,one_to_many,mapped
64200.03,64200,Milliners,"Tailors, dressmakers, furriers and milliners",03,False,3,one_to_many,mapped
64201.01,64201,Image consultants,"Image, social and other personal consultants",01,False,3,one_to_many,mapped
64201.02,64201,Wedding consultants,"Image, social and other personal consultants",02,False,3,one_to_many,mapped
64201.03,64201,Weight loss consultants,"Image, social and other personal consultants",03,False,3,one_to_many,mapped
64300.00,64300,Maîtres d'hôtel and hosts/hostesses,Maîtres d'hôtel and hosts/hostesses,00,True,1,one_to_one,mapped
64301.00,64301,Bartenders,Bartenders,00,True,1,one_to_one,mapped
64310.00,64310,Travel counsellors,Travel counsellors,00,True,1,one_to_one,mapped
64311.01,64311,Flight attendants,Pursers and flight attendants,01,False,3,one_to_many,mapped
64311.02,64311,"Flight pursers, customer service directors and passenger service directors",Pursers and flight attendants,02,False,3,one_to_many,mapped
64311.03,64311,Ship pursers,Pursers and flight attendants,03,False,3,one_to_many,mapped
64312.01,64312,"Airline passenger, baggage and ticket agents",Airline ticket and service agents,01,False,3,one_to_many,mapped
64312.02,64312,Airline cargo and freight agents,Airline ticket and service agents,02,False,3,one_to_many,mapped
64312.03,64312,Airline reservation agents,Airline ticket and service agents,03,False,3,one_to_many,mapped
64313.01,64313,Ticket agents and related clerks (except airline),"Ground and water transport ticket agents, cargo service representatives and related clerks",01,False,2,one_to_many,mapped
64313.02,64313,Cargo service representatives (except airline),"Ground and water transport ticket agents, cargo service representatives and related clerks",02,False,2,one_to_many,mapped
64314.00,64314,Hotel front desk clerks,Hotel front desk clerks,00,True,1,one_to_one,mapped
64320.01,64320,Tour guides,Tour and travel guides,01,False,2,one_to_many,mapped
64320.02,64320,Travel guides,Tour and travel guides,02,False,2,one_to_many,mapped
64321.00,64321,Casino workers,Casino workers,00,True,1,one_to_one,mapped
64322.00,64322,Outdoor sport and recreational guides,Outdoor sport and recreational guides,00,True,1,one_to_one,mapped
64400.00,64400,Customer services representatives - financial institutions,Customer services representatives - financial institutions,00,True,1,one_to_one,mapped
64401.00,64401,Postal services representatives,Postal services representatives,00,True,1,one_to_one,mapped
64409.00,64409,Other customer and information services representatives,Other customer and information services representatives,00,True,1,one_to_one,mapped
64410.01,64410,Security guards,Security guards and related security service occupations,01,False,5,one_to_many,mapped
64410.02,64410,Armoured car guards,Security guards and related security service occupations,02,False,5,one_to_many,mapped
64410.03,64410,Corporate security officers,Security guards and related security service occupations,03,False,5,one_to_many,mapped
64410.04,64410,Private investigators,Security guards and related security service occupations,04,False,5,one_to_many,mapped
64410.05,64410,Retail loss prevention officers,Security guards and related security service occupations,05,False,5,one_to_many,mapped
65100.00,65100,Cashiers,Cashiers,00,True,1,one_to_one,mapped
65101.00,65101,Automotive and watercraft service station attendants,Service station attendants,00,True,1,one_to_one,mapped
65102.00,65102,"Store shelf stockers, clerks and order fillers","Store shelf stockers, clerks and order fillers",00,True,1,one_to_one,mapped
65109.01,65109,Demonstrators and direct distributors,Other sales related occupations,01,False,3,one_to_many,mapped
65109.02,65109,Door-to-door salespersons and street vendors,Other sales related occupations,02,False,3,one_to_many,mapped
65109.03,65109,Telephone solicitors and telemarketers,Other sales related occupations,03,False,3,one_to_many,mapped
65200.00,65200,Food and beverage servers,Food and beverage servers,00,True,1,one_to_one,mapped
65201.01,65201,Food counter attendants and food preparers,"Food counter attendants, kitchen helpers and related support occupations",01,False,4,one_to_many,mapped
65201.02,65201,Kitchen helpers,"Food counter attendants, kitchen helpers and related support occupations",02,False,4,one_to_many,mapped
65201.03,65201,Food service helpers,"Food counter attendants, kitchen helpers and related support occupations",03,False,4,one_to_many,mapped
65201.04,65201,Dishwashers,"Food counter attendants, kitchen helpers and related support occupations",04,False,4,one_to_many,mapped
65202.00,65202,Meat cutters and fishmongers - retail and wholesale,Meat cutters and fishmongers - retail and wholesale,00,True,1,one_to_one,mapped
65210.01,65210,Guest service attendants and baggage porters,"Support occupations in accommodation, travel and facilities set-up services",01,False,3,one_to_many,mapped
65210.02,65210,Ship and train service attendants,"Support occupations in accommodation, travel and facilities set-up services",02,False,3,one_to_many,mapped
65210.03,65210,Facilities workers,"Support occupations in accommodation, travel and facilities set-up services",03,False,3,one_to_many,mapped
65211.01,65211,Amusement attraction operators,"Operators and attendants in amusement, recreation and sport",01,False,2,one_to_many,mapped
65211.02,65211,"Attendants in amusement, recreation and sport","Operators and attendants in amusement, recreation and sport",02,False,2,one_to_many,mapped
65220.00,65220,Pet groomers and animal care workers,Pet groomers and animal care workers,00,True,1,one_to_one,mapped
65229.00,65229,Other support occupations in personal services,Other support occupations in personal services,00,True,1,one_to_one,mapped
65310.01,65310,Light duty cleaners,Light duty cleaners,01,False,2,one_to_many,mapped
65310.02,65310,Housekeepers,Light duty cleaners,02,False,2,one_to_many,mapped
65311.01,65311,Carpet and upholstery cleaners,Specialized cleaners,01,False,5,one_to_many,mapped
65311.02,65311,Chimney cleaners and sandblasters,Specialized cleaners,02,False,5,one_to_many,mapped
65311.03,65311,Furnace and ventilation system cleaners,Specialized cleaners,03,False,5,one_to_many,mapped
65311.04,65311,Vehicle cleaners,Specialized cleaners,04,False,5,one_to_many,mapped
65311.05,65311,Window cleaners,Specialized cleaners,05,False,5,one_to_many,mapped
65312.00,65312,"Janitors, caretakers and heavy-duty cleaners","Janitors, caretakers and heavy-duty cleaners",00,True,1,one_to_one,mapped
65320.01,65320,Dry cleaning and laundry machine operators,"Dry cleaning, laundry and related occupations",01,False,3,one_to_many,mapped
65320.02,65320,Dry cleaning and laundry inspectors and assemblers,"Dry cleaning, laundry and related occupations",02,False,3,one_to_many,mapped
65320.03,65320,"Ironing, pressing and finishing workers","Dry cleaning, laundry and related occupations",03,False,3,one_to_many,mapped
65329.01,65329,Beauty salon attendants,Other service support occupations,01,False,7,one_to_many,mapped
65329.02,65329,Door attendants,Other service support occupations,02,False,7,one_to_many,mapped
65329.03,65329,Funeral home attendants,Other service support occupations,03,False,7,one_to_many,mapped
65329.04,65329,Laundromat attendants,Other service support occupations,04,False,7,one_to_many,mapped
65329.05,65329,Parking lot attendants and car jockeys,Other service support occupations,05,False,7,one_to_many,mapped
65329.06,65329,Ticket takers and ushers,Other service support occupations,06,False,7,one_to_many,mapped
65329.07,65329,Other elemental service workers,Other service support occupations,07,False,7,one_to_many,mapped
70010.00,70010,Construction managers,Construction managers,00,True,1,one_to_one,mapped
70011.00,70011,Home building and renovation managers,Home building and renovation managers,00,True,1,one_to_one,mapped
70012.01,70012,Facility operation managers,Facility operation and maintenance managers,01,False,2,one_to_many,mapped
70012.02,70012,Maintenance managers,Facility operation and maintenance managers,02,False,2,one_to_many,mapped
70020.01,70020,"Transportation managers, operations",Managers in transportation,01,False,2,one_to_many,mapped
70020.02,70020,"Transportation managers, freight traffic",Managers in transportation,02,False,2,one_to_many,mapped
70021.00,70021,Postal and courier services managers,Postal and courier services managers,00,True,1,one_to_one,mapped
72010.00,72010,"Contractors and supervisors, machining, metal forming, shaping and erecting trades and related occupations","Contractors and supervisors, machining, metal forming, shaping and erecting trades and related occupations",00,True,1,one_to_one,mapped
72011.00,72011,"Contractors and supervisors, electrical trades and telecommunications occupations","Contractors and supervisors, electrical trades and telecommunications occupations",00,True,1,one_to_one,mapped
72012.00,72012,"Contractors and supervisors, pipefitting trades","Contractors and supervisors, pipefitting trades",00,True,1,one_to_one,mapped
72013.00,72013,"Contractors and supervisors, carpentry trades","Contractors and supervisors, carpentry trades",00,True,1,one_to_one,mapped
72014.00,72014,"Contractors and supervisors, other construction trades, installers, repairers and servicers","Contractors and supervisors, other construction trades, installers, repairers and servicers",00,True,1,one_to_one,mapped
72020.00,72020,"Contractors and supervisors, mechanic trades","Contractors and supervisors, mechanic trades",00,True,1,one_to_one,mapped
72021.00,72021,"Contractors and supervisors, heavy equipment operator crews","Contractors and supervisors, heavy equipment operator crews",00,True,1,one_to_one,mapped
72022.00,72022,"Supervisors, printing and related occupations","Supervisors, printing and related occupations",00,True,1,one_to_one,mapped
72023.00,72023,"Supervisors, railway transport operations","Supervisors, railway transport operations",00,True,1,one_to_one,mapped
72024.00,72024,"Supervisors, motor transport and other ground transit operators","Supervisors, motor transport and other ground transit operators",00,True,1,one_to_one,mapped
72025.00,72025,"Supervisors, mail and message distribution occupations","Supervisors, mail and message distribution occupations",00,True,1,one_to_one,mapped
72100.01,72100,Machinists,Machinists and machining and tooling inspectors,01,False,2,one_to_many,mapped
72100.02,72100,Machining and tooling inspectors,Machinists and machining and tooling inspectors,02,False,2,one_to_many,mapped
72101.01,72101,Tool and die makers,Tool and die makers,01,False,2,one_to_many,mapped
72101.02,72101,Metal mould makers and patternmakers,Tool and die makers,02,False,2,one_to_many,mapped
72102.00,72102,Sheet metal workers,Sheet metal workers,00,True,1,one_to_one,mapped
72103.00,72103,Boilermakers,Boilermakers,00,True,1,one_to_one,mapped
72104.00,72104,Structural metal and platework fabricators and fitters,Structural metal and platework fabricators and fitters,00,True,1,one_to_one,mapped
72105.00,72105,Ironworkers,Ironworkers,00,True,1,one_to_one,mapped
72106.01,72106,Welders,Welders and related machine operators,01,False,2,one_to_many,mapped
72106.02,72106,"Welding, brazing and soldering machine  operators",Welders and related machine operators,02,False,2,one_to_many,mapped
72200.00,72200,Electricians (except industrial and power system),Electricians (except industrial and power system),00,True,1,one_to_one,mapped
72201.00,72201,Industrial electricians,Industrial electricians,00,True,1,one_to_one,mapped
72202.00,72202,Power system electricians,Power system electricians,00,True,1,one_to_one,mapped
72203.00,72203,Electrical power line and cable workers,Electrical power line and cable workers,00,True,1,one_to_one,mapped
72204.00,72204,Telecommunications line and cable installers and repairers,Telecommunications line and cable installers and repairers,00,True,1,one_to_one,mapped
72205.01,72205,Telephone installers and repairers,Telecommunications equipment installation and cable television service technicians,01,False,5,one_to_many,mapped
72205.02,72205,Switch network installers and repairers,Telecommunications equipment installation and cable television service technicians,02,False,5,one_to_many,mapped
72205.03,72205,Telecommunications service testers,Telecommunications equipment installation and cable television service technicians,03,False,5,one_to_many,mapped
72205.04,72205,Telecommunications equipment technicians,Telecommunications equipment installation and cable television service technicians,04,False,5,one_to_many,mapped
72205.05,72205,Television cable service technicians,Telecommunications equipment installation and cable television service technicians,05,False,5,one_to_many,mapped
72300.00,72300,Plumbers,Plumbers,00,True,1,one_to_one,mapped
